{
  "$schema": "./fontes.schema.json",
  "schema_version": 1,
  "pipeline_version": "1.1.0",
  "diretorio_publicado": "ferramentas/pesquisa/vade-mecum/data",
  "politica_promocao": {
    "limite_mudanca_percentual": 25,
    "limite_mudanca_minimo": 20
  },
  "conjuntos": {
    "legislacao": {
      "familia": "legislacao",
      "adaptador": "planalto_html_v1",
      "chave_colecao": "artigos",
      "fontes": [
        {
          "id": "adct",
          "codigo": "ADCT",
          "url": "https://www.planalto.gov.br/ccivil_03/constituicao/constituicaocompilado.htm",
          "arquivo_bruto": "adct.html",
          "destino": "lei_adct.json"
        },
        {
          "id": "cc",
          "codigo": "CC",
          "url": "https://www.planalto.gov.br/ccivil_03/leis/2002/l10406compilada.htm",
          "arquivo_bruto": "cc.html",
          "destino": "lei_cc.json"
        },
        {
          "id": "cdc",
          "codigo": "CDC",
          "url": "https://www.planalto.gov.br/ccivil_03/leis/l8078compilado.htm",
          "arquivo_bruto": "cdc.html",
          "destino": "lei_cdc.json"
        },
        {
          "id": "ce",
          "codigo": "CE",
          "url": "https://www.planalto.gov.br/ccivil_03/leis/l4737compilado.htm",
          "arquivo_bruto": "ce.html",
          "destino": "lei_ce.json"
        },
        {
          "id": "cf",
          "codigo": "CF",
          "url": "https://www.planalto.gov.br/ccivil_03/constituicao/constituicaocompilado.htm",
          "arquivo_bruto": "cf.html",
          "destino": "lei_cf.json"
        },
        {
          "id": "clt",
          "codigo": "CLT",
          "url": "https://www.planalto.gov.br/ccivil_03/decreto-lei/del5452compilado.htm",
          "arquivo_bruto": "clt.html",
          "destino": "lei_clt.json",
          "inicio_apos": "CONSOLIDAÇÃO DAS LEIS DO TRABALHO"
        },
        {
          "id": "cp",
          "codigo": "CP",
          "url": "https://www.planalto.gov.br/ccivil_03/decreto-lei/del2848compilado.htm",
          "arquivo_bruto": "cp.html",
          "destino": "lei_cp.json"
        },
        {
          "id": "cpc",
          "codigo": "CPC",
          "url": "https://www.planalto.gov.br/ccivil_03/_ato2015-2018/2015/lei/l13105compilada.htm",
          "arquivo_bruto": "cpc.html",
          "destino": "lei_cpc.json"
        },
        {
          "id": "cpp",
          "codigo": "CPP",
          "url": "https://www.planalto.gov.br/ccivil_03/decreto-lei/del3689compilado.htm",
          "arquivo_bruto": "cpp.html",
          "destino": "lei_cpp.json"
        },
        {
          "id": "ctb",
          "codigo": "CTB",
          "url": "https://www.planalto.gov.br/ccivil_03/leis/l9503compilado.htm",
          "arquivo_bruto": "ctb.html",
          "destino": "lei_ctb.json"
        },
        {
          "id": "ctn",
          "codigo": "CTN",
          "url": "https://www.planalto.gov.br/ccivil_03/leis/l5172compilado.htm",
          "arquivo_bruto": "ctn.html",
          "destino": "lei_ctn.json"
        },
        {
          "id": "eca",
          "codigo": "ECA",
          "url": "https://www.planalto.gov.br/ccivil_03/leis/l8069compilado.htm",
          "arquivo_bruto": "eca.html",
          "destino": "lei_eca.json"
        },
        {
          "id": "lbps",
          "codigo": "LBPS",
          "url": "https://www.planalto.gov.br/ccivil_03/leis/l8213compilado.htm",
          "arquivo_bruto": "lbps.html",
          "destino": "lei_lbps.json"
        },
        {
          "id": "ld",
          "codigo": "LD",
          "url": "https://www.planalto.gov.br/ccivil_03/_ato2004-2006/2006/lei/l11343.htm",
          "arquivo_bruto": "ld.html",
          "destino": "lei_ld.json"
        },
        {
          "id": "lep",
          "codigo": "LEP",
          "url": "https://www.planalto.gov.br/ccivil_03/leis/l7210compilado.htm",
          "arquivo_bruto": "lep.html",
          "destino": "lei_lep.json"
        },
        {
          "id": "lgpd",
          "codigo": "LGPD",
          "url": "https://www.planalto.gov.br/ccivil_03/_ato2015-2018/2018/lei/l13709compilado.htm",
          "arquivo_bruto": "lgpd.html",
          "destino": "lei_lgpd.json"
        },
        {
          "id": "lindb",
          "codigo": "LINDB",
          "url": "https://www.planalto.gov.br/ccivil_03/decreto-lei/del4657compilado.htm",
          "arquivo_bruto": "lindb.html",
          "destino": "lei_lindb.json"
        },
        {
          "id": "llc",
          "codigo": "LLC",
          "url": "https://www.planalto.gov.br/ccivil_03/_ato2019-2022/2021/lei/l14133.htm",
          "arquivo_bruto": "llc.html",
          "destino": "lei_llc.json"
        },
        {
          "id": "lmp",
          "codigo": "LMP",
          "url": "https://www.planalto.gov.br/ccivil_03/_ato2004-2006/2006/lei/l11340.htm",
          "arquivo_bruto": "lmp.html",
          "destino": "lei_lmp.json"
        }
      ]
    },
    "sumulas_stj": {
      "familia": "sumulas",
      "adaptador": "sumulas_stj_html_v1",
      "chave_colecao": "sumulas",
      "destino": "sumulas_stj.json",
      "fontes": [
        {
          "id": "catalogo",
          "url": "https://processo.stj.jus.br/SCON/sumstj/toc.jsp?tipo=sumula+ou+su&l=1000&ordenacao=%40NUM",
          "arquivo_bruto": "catalogo.html"
        }
      ]
    },
    "sumulas_stf": {
      "familia": "sumulas",
      "adaptador": "sumulas_stf_html_v1",
      "chave_colecao": "sumulas",
      "destino": "sumulas_stf.json",
      "fontes": [
        {
          "id": "catalogo",
          "url": "https://portal.stf.jus.br/jurisprudencia/sumariosumulas.asp?base=30",
          "arquivo_bruto": "catalogo.html",
          "expande_detalhes": true
        }
      ]
    },
    "sumulas_vinculantes": {
      "familia": "sumulas",
      "adaptador": "sumulas_stf_html_v1",
      "chave_colecao": "sumulas",
      "destino": "sumulas_vinculantes.json",
      "vinculante": true,
      "fontes": [
        {
          "id": "catalogo",
          "url": "https://portal.stf.jus.br/jurisprudencia/sumariosumulas.asp?base=26",
          "arquivo_bruto": "catalogo.html",
          "expande_detalhes": true
        }
      ]
    },
    "jurisprudencia_teses_stj": {
      "familia": "jurisprudencia_em_teses",
      "adaptador": "jt_stj_html_v1",
      "chave_colecao": "teses",
      "destino": "jt_stj.json",
      "fontes": [
        {
          "id": "indice",
          "url": "https://processo.stj.jus.br/SCON/jt/jt.jsp",
          "arquivo_bruto": "indice.html",
          "expande_edicoes": true
        }
      ]
    },
    "temas_repetitivos_stj": {
      "familia": "precedentes_qualificados",
      "adaptador": "temas_stj_csv_v1",
      "chave_colecao": "temas",
      "destino": "flash_temas_stj.json",
      "package_id": "4238da2f-c07b-4c1a-b345-4402accacdcf",
      "join_key": "sequencialPrecedente",
      "fontes": [
        {
          "id": "metadados",
          "url": "https://dadosabertos.web.stj.jus.br/api/3/action/package_show?id=precedentes-qualificados",
          "arquivo_bruto": "metadados.json"
        },
        {
          "id": "temas",
          "resource_id": "df29da13-7d6b-41ba-ad96-cd1a5bbd191c",
          "url": "https://dadosabertos.web.stj.jus.br/dataset/4238da2f-c07b-4c1a-b345-4402accacdcf/resource/df29da13-7d6b-41ba-ad96-cd1a5bbd191c/download/temas.csv",
          "arquivo_bruto": "temas.csv"
        },
        {
          "id": "processos",
          "resource_id": "7ed21202-0049-4fcb-aa7c-48d810d3c499",
          "url": "https://dadosabertos.web.stj.jus.br/dataset/4238da2f-c07b-4c1a-b345-4402accacdcf/resource/7ed21202-0049-4fcb-aa7c-48d810d3c499/download/processos.csv",
          "arquivo_bruto": "processos.csv"
        }
      ]
    },
    "temas_rg_stf": {
      "familia": "precedentes_rg_stf",
      "adaptador": "temas_rg_stf_html_v1",
      "chave_colecao": "temas",
      "destino": "temas_rg_stf.json",
      "fontes": [
        {
          "id": "exportar",
          "url": "https://portal.stf.jus.br/jurisprudenciaRepercussao/exportarDados.asp",
          "arquivo_bruto": "repercussao_geral.xls"
        }
      ]
    },
    "informativo_stf": {
      "familia": "informativo",
      "adaptador": "informativo_stf_xlsx_v1",
      "chave_colecao": "informativos",
      "destino": "informativo_stf.json",
      "fontes": [
        {
          "id": "planilha",
          "url": "https://www.stf.jus.br/arquivo/cms/informativoSTF/anexo/Informativo_Dados/Dados_InformativosSTF.xlsx",
          "arquivo_bruto": "Dados_InformativosSTF.xlsx"
        }
      ]
    },
    "espelhos_stj": {
      "familia": "espelhos_stj",
      "adaptador": "espelhos_stj_ckan_v1",
      "chave_colecao": "espelhos",
      "destino": "espelhos_stj.json",
      "fontes": [
        {
          "id": "corte-especial",
          "url": "https://dadosabertos.web.stj.jus.br/api/3/action/package_show?id=espelhos-de-acordaos-corte-especial",
          "arquivo_bruto": "corte-especial/package.json"
        },
        {
          "id": "primeira-secao",
          "url": "https://dadosabertos.web.stj.jus.br/api/3/action/package_show?id=espelhos-de-acordaos-primeira-secao",
          "arquivo_bruto": "primeira-secao/package.json"
        },
        {
          "id": "segunda-secao",
          "url": "https://dadosabertos.web.stj.jus.br/api/3/action/package_show?id=espelhos-de-acordaos-segunda-secao",
          "arquivo_bruto": "segunda-secao/package.json"
        },
        {
          "id": "terceira-secao",
          "url": "https://dadosabertos.web.stj.jus.br/api/3/action/package_show?id=espelhos-de-acordaos-terceira-secao",
          "arquivo_bruto": "terceira-secao/package.json"
        }
      ]
    },
    "indices_auxiliares": {
      "familia": "indice_derivado",
      "adaptador": null,
      "atualizacao": "reproduzível desde BASE-010",
      "gerador": "ferramentas/manutencao/gerar_indices_derivados.py",